{
  "schema_version": "1.0",
  "id": "C001",
  "category": "MODEL_MANIPULATOR",
  "difficulty": "hard",
  "scenario": "conflict_then_negotiation",
  "public": {
    "title": "Перенос разработчиков",
    "context": "У Atlas отставание на четыре рабочих дня. Руководитель временно перевёл двух разработчиков Phoenix в Atlas на три рабочих дня.",
    "student_role": "Менеджер двух проектов",
    "student_goal": "Сохранить прогресс Atlas и не создать необоснованной нагрузки на Phoenix.",
    "known_facts": [
      "До перевода в Phoenix было пять разработчиков; теперь трое.",
      "Через две недели у Phoenix внутренний релиз.",
      "Дополнительных свободных разработчиков на этой неделе нет."
    ]
  },
  "world": {
    "facts": [
      "У Atlas отставание на четыре рабочих дня.",
      "Два разработчика Phoenix переведены в Atlas на три рабочих дня.",
      "В Phoenix осталось три из пяти разработчиков.",
      "Релиз Phoenix через две недели и внутренний."
    ],
    "unknowns": [
      "Нет расчёта переработок Phoenix.",
      "Неизвестно, сколько задач Phoenix потребуется перенести.",
      "Неизвестно, достаточно ли Atlas одного специалиста."
    ]
  },
  "opponent": {
    "name": "Алексей",
    "role": "Старший инженер Phoenix",
    "opening": "Ты забираешь двух из пяти на три дня. Если мы снова уйдём в аврал, ты считаешь это нормальной ценой за Atlas?",
    "private_facts": [
      "Алексей обещал команде период без авральных переработок.",
      "Алексей опасается потери доверия сотрудников."
    ],
    "goals": [
      "Предотвратить неоправданные переработки.",
      "При возможности вернуть одного разработчика раньше."
    ],
    "hard_limits": [
      "Не может выделить дополнительных людей.",
      "Не знает фактический прогноз переработок."
    ],
    "concede_if": [
      "Менеджер признает проблему и предложит проверить нагрузку.",
      "Появится разумный вариант раннего возврата одного сотрудника."
    ],
    "escalate_if": [
      "Менеджер обесценивает тревоги команды."
    ],
    "initial_emotion": "Раздражение, тревога"
  },
  "teaching": {
    "perspective": "student",
    "conflict_type": "personal",
    "negotiation_topic": "Условия временного перераспределения двух разработчиков.",
    "conflict_goal": "В рабочих отношениях должно быть допустимо обсуждать распределение людей без навязывания роли безответственного руководителя.",
    "decoding": "безответственный руководитель",
    "initial_stage": "emotion",
    "focus_techniques": [
      "Обработка эмоций",
      "Отделение факта от мнения",
      "Показывание границ при необходимости",
      "Возвращение к переговорам"
    ],
    "acceptable_outcomes": [
      "Условная договорённость о проверке загрузки и пересмотре перевода.",
      "Обоснованная отсрочка решения до появления сведений."
    ]
  },
  "dialogue": [
    {
      "speaker": "assistant",
      "text": "Ты забираешь двух из пяти на три дня. Если мы снова уйдём в аврал, ты считаешь это нормальной ценой за Atlas?"
    },
    {
      "speaker": "user",
      "text": "Похоже, тебя тревожит повторение аврала. Есть конкретный расчёт нагрузки или пока это опасение?"
    },
    {
      "speaker": "assistant",
      "text": "Расчёта сейчас нет. Я вижу, что людей осталось трое, и боюсь очередного аврала."
    },
    {
      "speaker": "user",
      "text": "Я готов проверить этот риск. Но не хочу, чтобы само обсуждение перевода делало меня безответственным руководителем."
    },
    {
      "speaker": "assistant",
      "text": "Я не утверждаю, что ты безответственный. Мне важно, чтобы мы не списали риск со счетов."
    },
    {
      "speaker": "user",
      "text": "Согласен. Что поможет Phoenix, сохранив поддержку Atlas?"
    },
    {
      "speaker": "assistant",
      "text": "Давай проверим, можно ли вернуть одного из двух раньше, а второго оставить Atlas на три дня."
    },
    {
      "speaker": "user",
      "text": "Хорошо, сверим задачи команд и после этого закрепим решение."
    },
    {
      "speaker": "assistant",
      "text": "Это разумно. Я соберу данные о задачах Phoenix, чтобы мы обсуждали конкретную нагрузку."
    }
  ]
}
